key,value,color,description,los,buffer,anchor,water
barrier,motorcycle_barrier,#1e293b,A barrier along a path preventing access by motorcycles.,False,False,False,False
barrier,retaining_wall,#1e293b,A linear structure that holds back soil or rock. (Lower side to right.),False,False,False,False
barrier,rope,#1e293b,A flexible barrier made of rope.,False,False,False,False
barrier,sally_port,#1e293b,"A secure, controlled entryway to a fortification or prison.",False,False,False,False
barrier,spikes,#1e293b,Spikes on the ground preventing unauthorized access.,False,False,False,False
barrier,stile,#1e293b,"A structure which provides people a passage through or over a boundary via steps, ladders or narrow gaps.",False,False,False,False
barrier,sump_buster,#1e293b,A barrier to stop cars (two tracked vehicles with less than a certain ground clearance and width between tracks).,False,False,False,False
barrier,swing_gate,#1e293b,A gate consisting of a bar or pole pivoted (rotates sidewards to open) in such a way as to allow the boom to block vehicular access through a controlled point.,False,False,False,False
barrier,toll_booth,#1e293b,A place where a road usage toll or fee is collected.,False,False,False,False
barrier,turnstile,#1e293b,"A turnstile, a passage on foot designed to allow one person at a time to pass",False,False,False,False
barrier,wall,#1e293b,"A freestanding structure, designed to restrict or prevent movement across a boundary, typically made from solid brick, concrete or rocks, and almost always built so that it is opaque to vision.",False,False,False,False
barrier,yes,#1e293b,"Unspecified barrier. If possible, use a more specific value.",False,False,False,False
boundary,aboriginal_lands,#be185d,A boundary representing official reservation boundaries of recognized aboriginal / indigenous / native peoples.,False,False,False,False
boundary,administrative,#be185d,"An administrative boundary. Subdivisions of areas/territories/jurisdictions recognised by governments or other organisations for administrative purposes. These range from large groups of nation states right down to small administrative districts and suburbs, as indicated by the",True,True,False,False
boundary,census,#be185d,"A census-designated boundary delineating a statistical area, not necessarily observable on the ground.",True,True,False,False
boundary,disputed,#be185d,An area of landed claimed by two or more parties (use with caution). See also,True,True,False,False
boundary,forest,#be185d,"A delimited forest is a land which is predominantly wooded and which is, for this reason, given defined boundaries. It may cover different tree stands, non-wooded areas, highways… but all the area within the boundaries are considered and managed as a single forest.",True,True,False,False
boundary,forest_compartment,#be185d,"A forest compartment is a numbered sub-division within a delimited forest, physically materialized with visible, typically cleared, boundaries.",True,True,False,False
boundary,health,#be185d,Health division boundaries. Some mappers use,True,True,False,False
boundary,historic,#be185d,A historic administrative boundary (use judiciously).,True,True,False,False
boundary,limited_traffic_zone,#be185d,Describes an officially designated area that requires authorization for the entry of certain vehicles.,True,True,False,False
boundary,local_authority,#be185d,Describes the territory of a local authority.,True,True,False,False
boundary,low_emission_zone,#be185d,A geographically defined area which seeks to restrict or deter access by certain polluting vehicles with the aim of improving the air quality.,True,True,False,False
boundary,national_park,#be185d,"Area of outstanding natural beauty, set aside for conservation and for recreation (",True,True,False,False
boundary,place,#be185d,boundary,True,True,False,False
boundary,political,#be185d,Electoral boundaries,True,True,False,False
boundary,postal_code,#be185d,Postal code boundaries. Some mappers use,True,True,False,False
boundary,public_transport,#be185d,An operating area of a transit authority.,True,True,False,False
boundary,special_economic_zone,#be185d,A government-defined area in which business and trade laws are different.,True,True,False,False
boundary,statistical,#be185d,An official boundary recognised by government for statistical purposes.,True,True,False,False
boundary,timezone,#be185d,Boundaries of time zone,True,True,False,False
boundary,*,#be185d,All commonly used values,True,True,False,False
boundary,border_zone,#be185d,A border zone is an area near the border where special restrictions on movement apply. Usually a permit is required for visiting.,False,False,False,False
boundary,hazard,#be185d,"A designated hazardous area, with a potential source of damage to health, life, property, or any other interest of value.",False,False,False,False
boundary,maritime,#be185d,"Maritime boundaries which are not administrative boundaries: the Baseline, Contiguous Zone and EEZ (Exclusive Economic Zone).",True,True,False,False
boundary,marker,#be185d,"A boundary marker, border marker, boundary stone, or border stone is a robust physical marker that identifies the start of a land boundary or the change in a boundary, especially a change in direction of a boundary. See alsohistoric=boundary_stone",False,False,False,False
boundary,protected_area,#be185d,"Protected areas, such as for national parks, marine protection areas, heritage sites, wilderness, cultural assets and similar.",False,False,False,False
boundary,religious_administration,#be185d,"A religious administration boundary, eg. of a catholic diocese or parish. Usereligion=*anddenomination=*to specify the church to which the boundary applies. Some mappers usereligious_level=*instead ofadmin_level=*to specify level in the church hierarchy.",True,True,False,False
building,allotment_house,#d97706,A small outbuilding for short visits in a allotment garden.,False,False,False,False
building,apartments,#d97706,"A building arranged into individual dwellings, often on separate floors. May also have retail outlets on the ground floor.",False,False,False,False
building,bakehouse,#d97706,A building that was built as a bakehouse (i.e. for baking bread). Often used in conjunction with another nodeamenity=baking_ovenandoven=wood_fired.,False,False,False,False
building,barn,#d97706,An agricultural building that can be used for storage and as a covered workplace.,False,False,False,False
building,beach_hut,#d97706,"A small, usually wooden, and often brightly coloured cabin or shelter above the high tide mark on popular bathing beaches.",False,False,False,False
building,carport,#d97706,"Acarportis a covered structure used to offer limited protection to vehicles, primarily cars, from the elements. Unlike most structures a carport does not have four walls, and usually has one or two.",False,False,False,False
building,commercial,#d97706,"A building for non-specific commercial activities, not necessarily an office building. Consider tagging the surrounding area usinglanduse=commercialif there is such use. Use 'retail' if the building consists primarily of shops.",False,False,False,False
building,digester,#d97706,A digester is a bioreactor for the production of biogas from biomass.,False,False,False,False
building,grandstand,#d97706,"The main stand, usually roofed, commanding the best view for spectators at racecourses or sports grounds.",False,False,False,False
building,religious,#d97706,Unspecific building related to religion. Prefer more specific values if possible.,False,False,False,False
building,annexe,#d97706,"An annexe is a small self contained apartments, collages, or small residential building on the same property as the main residential unit.",False,False,False,False
building,barracks,#d97706,Buildings built to house military personnel or laborers.,False,False,False,False
building,boathouse,#d97706,A boathouse is a building used for the storage of boats.,False,False,False,False
building,bridge,#d97706,A building used as a bridge (skyway). To map a gatehouse usebuilding=gatehouse. See alsobridge=yesforhighway=*.Don't use this tag just for marking bridges (their outlines). For such purposes useman_made=bridge.,False,False,False,False
building,bungalow,#d97706,"A single-storey detached small house, Dacha.",False,False,False,False
building,bunker,#d97706,A hardened military building. Also usemilitary=bunker.,False,False,False,False
building,cabin,#d97706,"Acabinis a small, roughly built house usually with a wood exterior and typically found in rural areas.",False,False,False,False
building,castle,#d97706,A building constructed as a castle. Can be further specified withhistoric=castle+castle_type=*.,False,False,False,False
building,cathedral,#d97706,"A building that was built as a cathedral. Used in conjunction withamenity=place_of_worship,religion=*,denomination=*andlanduse=religiousfor the cathedral grounds where it is in current use.",False,False,False,False
building,chapel,#d97706,"A building that was built as a chapel. Used in conjunction withamenity=place_of_worship,religion=*,denomination=*andlanduse=religiousfor the chapel grounds where it is in current use.",False,False,False,False
building,church,#d97706,"A building that was built as a church. Used in conjunction withamenity=place_of_worship,religion=*,denomination=*andlanduse=religiousfor the church grounds where it is in current use.",False,False,False,False
building,civic,#d97706,"A generic tag for a building created to house some civic amenity, for exampleamenity=community_centre,amenity=library,amenity=toilets,leisure=sports_centre,leisure=swimming_pool,amenity=townhalletc. Useamenity=*orleisure=*etc. to provide further details. Seebuilding=publicand more specific tags likebuilding=libraryas well.",False,False,False,False
building,clock_tower,#d97706,"Clock towers are very high towers, visible from its surroundings, usually in central parts of town and squares, housing a turret clock with one or more clock faces, most often four. They are freestanding structures but can also be adjoined or located on top of another building.",False,False,False,False
building,college,#d97706,A college building. Useamenity=collegeon the whole college area to represent the college as an institution.,False,False,False,False
building,conservatory,#d97706,A building or room having glass or tarpaulin roofing and walls used as an indoor garden or a sunroom (winter garden).,False,False,False,False
building,construction,#d97706,Used for buildings under construction. Useconstruction=*to hold the value for the completed building.,False,False,False,False
building,container,#d97706,"For a container used as a permanent building.Do not map containers placed temporarily, for example used in shipping or construction.",False,False,False,False
building,cowshed,#d97706,"A cowshed (cow barn, cow house) is a building for housing cows, usually found on farms.",False,False,False,False
building,detached,#d97706,"A detached house, a free-standing residential building usually housing a single family.",False,False,False,False
building,dormitory,#d97706,"A shared building intended for college/university students (not a share room for multiple occupants as implied by the term in British English). Alternatively, use building=residential plusresidential=universityand loose the information that it is for students.",False,False,False,False
building,farm,#d97706,"A residential building on a farm (farmhouse). For other buildings see belowbuilding=farm_auxiliary,building=barn, … If in your country farmhouse looks same as general residential house then you can tag asbuilding=houseas well. See alsolanduse=farmyardfor the surrounding area",False,False,False,False
building,farm_auxiliary,#d97706,A building on a farm that is not a dwelling (use 'farm' or 'house' for the farm house).,False,False,False,False
building,fire_station,#d97706,"A building constructed as fire station, i.e. to house fire fighting equipment and officers, regardless of current use. Addamenity=fire_stationon the grounds for an active fire station.",False,False,False,False
building,garage,#d97706,"Agarageis a building suitable for the storage of one or possibly more motor vehicle or similar. Seebuilding=garagesfor larger shared buildings. For an aircraft garage, seebuilding=hangar.",False,False,False,False
building,garages,#d97706,A building that consists of a number of discrete storage spaces for different owners/tenants. See alsobuilding=garage.,False,False,False,False
building,gatehouse,#d97706,"An entry control point building, spanning over a highway that enters a city or compound.",False,False,False,False
building,ger,#d97706,A permanent or seasonal round yurt or ger.,False,False,False,False
building,government,#d97706,"For government buildings in general, including municipal, provincial and divisional secretaries, government agencies and departments, town halls, (regional) parliaments and court houses.",False,False,False,False
building,greenhouse,#d97706,Agreenhouseis a glass or plastic covered building used to grow plants. Uselanduse=greenhouse_horticulturefor an area containing multiple greenhouses,False,False,False,False
building,guardhouse,#d97706,Poste de garde.,False,False,False,False
building,hangar,#d97706,"Ahangaris a building used for the storage of airplanes, helicopters or space-craft. Consider addingaeroway=hangar, when appropriate.",False,False,False,False
building,hospital,#d97706,A building errected for a hospital. Useamenity=hospitalfor the hospital grounds.,False,False,False,False
building,hotel,#d97706,A building designed with separate rooms available for overnight accommodation. Normally used in conjunction withtourism=hotelfor the hotel grounds including recreation areas and parking.,False,False,False,False
building,house,#d97706,"A dwelling unit inhabited by a single household (a family or small group sharing facilities such as a kitchen). Houses forming half of a semi-detached pair, or one of a row of terraced houses, should share at least two nodes with joined neighbours, thereby defining theparty wallbetween the properties.",False,False,False,False
building,houseboat,#d97706,A boat used primarily as a home,False,False,False,False
building,hut,#d97706,"Ahutis a small and crude shelter. Note that this word hastwo meanings- it may be synonym ofbuilding=shed, it may be a residential building of low quality.",False,False,False,False
building,industrial,#d97706,A building for industrial purposes. Use warehouse if the purpose is known to be primarily for storage/distribution. Consider usinglanduse=industrialfor the surrounding area and appropriate tags likeman_made=worksto describe the industrial activity.,False,False,False,False
building,kindergarten,#d97706,"For any generic kindergarten buildings. Buildings for specific uses (sports halls etc.) should be tagged for their purpose. If there is currently a kindergarten in the building, useamenity=kindergartenon the perimeter of the kindergarten grounds.",False,False,False,False
building,kingdom_hall,#d97706,"A building that was built as aKingdom Hall. Often used in conjunction withamenity=place_of_worship,religion=christian,denomination=jehovahs_witnessandlanduse=religiousfor the grounds where it is in current use.",False,False,False,False
building,kiosk,#d97706,A small one-room retail building.,False,False,False,False
building,livestock,#d97706,"A building for housing/rising other livestock (apart from cows, horses or pigs covered above), or when the livestock changes.",False,False,False,False
building,military,#d97706,A military building. Also usemilitary=*.,False,False,False,False
building,monastery,#d97706,"A building constructed asmonastery. Often, monasteries consist of several distinct buildings with specific functions. For active monasteries (communities), useamenity=monastery, for the grounds of a former monastery, have a look athistoric=monastery",False,False,False,False
building,mosque,#d97706,"A building errected as mosque. Used in conjunction withamenity=place_of_worship,religion=*,denomination=*andlanduse=religiousfor the grounds where it is in current use.",False,False,False,False
building,museum,#d97706,A building which was designed as a museum.,False,False,False,False
building,office,#d97706,An office building. Useoffice=*where applicable for the business(es) that use the building. Consider tagging the surrounding area usinglanduse=commercialif it applies. Preferlanduse=retailif the building consists primarily of shops.,False,False,False,False
building,outbuilding,#d97706,A less important building near to and on the same piece of land as a larger building.,False,False,False,False
building,pagoda,#d97706,A building constructed as a pagoda.,False,False,False,False
building,parking,#d97706,Structure purpose-built for parking cars.,False,False,False,False
building,pavilion,#d97706,"A sports pavilion usually with changing rooms, storage areas and possibly an space for functions & events. Avoid using this term for other structures called pavilions by architects (seePavilion)",False,False,False,False
building,presbytery,#d97706,A building where priests live and work.,False,False,False,False
building,public,#d97706,"A building constructed as accessible to the general public (a town hall, police station, court house, etc.).",False,False,False,False
building,quonset_hut,#d97706,A lightweight prefabricated structure in the shape of a semicircle.,False,False,False,False
building,residential,#d97706,"A general tag for a building used primarily for residential purposes. Where additional detail is available consider using 'apartments', 'terrace', 'house', 'detached' or 'semidetached_house'.",False,False,False,False
building,retail,#d97706,"A building primarily used for selling goods that are sold to the public; useshop=*to identify the sort of goods sold or an appropriateamenity=*(pub, cafe, restaurant, etc.). Consider uselanduse=retailfor the surrounding area.",False,False,False,False
building,riding_hall,#d97706,A building that was built as a riding hall.,False,False,False,False
building,roof,#d97706,"A structure that consists of a roof with open sides, such as a rain shelter, and also gas stations",False,False,False,False
building,ruins,#d97706,"Frequently used for a house or other building that is abandoned and in poor repair. However, some believe this usage is incorrect, and the tag should only be used for buildings constructed as fake ruins (for example sham ruins in an English landscape garden). See alsolifecycle tagging.",False,False,False,False
building,school,#d97706,"A building errected as school. Buildings for specific uses (sports halls etc.) should be tagged for their purpose. If there is currently a school, useamenity=schoolon the  perimeter of the school grounds.",False,False,False,False
building,semidetached_house,#d97706,"A residential house that shares a common wall with another on one side. Typically called a ""duplex"" in American English.",False,False,False,False
building,service,#d97706,Service building usually is a small unmanned building with certain machinery (like pumps or transformers).,False,False,False,False
building,shed,#d97706,"Ashedis a simple, single-storey structure that is used for storage, hobbies, or as a workshop.",False,False,False,False
building,ship,#d97706,A decommissioned ship/submarine which stays in one place.,False,False,False,False
building,shrine,#d97706,"A building that was built as a shrine. Used in conjunction withamenity=place_of_worship,religion=*,denomination=*andlanduse=religiousfor the grounds where it is in current use. Small structures should considerhistoric=wayside_shrine.",False,False,False,False
building,silo,#d97706,A silo is a building for storing bulk materials,False,False,False,False
building,slurry_tank,#d97706,A circular building built to hold a liquid mix of primarily animal excreta (also known as slurry).,False,False,False,False
building,sports_centre,#d97706,A building that was built as a sports centre.,False,False,False,False
building,sports_hall,#d97706,A building that was built as a sports hall.,False,False,False,False
building,stable,#d97706,A building constructed as a stable for horses.,False,False,False,False
building,stadium,#d97706,"A building constructed to be a stadium building, including buildings that are abandoned and used nowadays for a different purpose.",False,False,False,False
building,static_caravan,#d97706,A mobile home (semi)permanently left on a single site,False,False,False,False
building,stilt_house,#d97706,A building raised on piles over the surface of the soil or a body of water,False,False,False,False
building,storage_tank,#d97706,Storage tanks are containers that hold liquids,False,False,False,False
building,sty,#d97706,"Asty(pigsty, pig ark, pig-shed) is a building for raising domestic pigs, usually found on farms.",False,False,False,False
building,supermarket,#d97706,A building constructed to house a self-service large-area store.,False,False,False,False
building,synagogue,#d97706,"A building that was built as a synagogue. Used in conjunction withamenity=place_of_worship,religion=*,denomination=*andlanduse=religiousfor the grounds where it is in current use.",False,False,False,False
building,tech_cab,#d97706,"This article or section containsquestionable, contentiousorcontroversial information. See thetalk pagefor more information.Overlaps with predominatebuilding=service+building:prefabricated=yesSmall prefabricated cabin structures for the air-conditioned accommodation of different technology.",False,False,False,False
building,temple,#d97706,"A building that was built as a temple. Used in conjunction withamenity=place_of_worship,religion=*,denomination=*andlanduse=religiousfor the grounds where it is in current use.",False,False,False,False
building,tent,#d97706,For a permanently placed tent.Do not map tents placed temporarily.,False,False,False,False
building,terrace,#d97706,"A single way used to define the outline of a linear row of residential dwellings, each of which normally has its own entrance, which form a terrace (""row-house"" or ""townhouse"" in North American English). Consider defining each dwelling separately using 'house'.",False,False,False,False
building,toilets,#d97706,A toilet block.,False,False,False,False
building,tower,#d97706,A tower-building. Best combined withtower:type=*. See alsoman_made=towerfor a tag with a similar definition.,False,False,False,False
building,train_station,#d97706,"A building constructed to be a train station building, including buildings that are abandoned and used nowadays for a different purpose.",False,False,False,False
building,transformer_tower,#d97706,A transformer tower is a characteristic tall building comprising a distribution transformer and constructed to connect directly  to a medium voltage overhead power line. Quite often the power line has since been undergrounded but the building may still serve as a substation. If the building is still in use as a substation it should additionally be tagged aspower=substation+substation=minor_distribution.,False,False,False,False
building,transportation,#d97706,"A building related to public transport. You will probably want to tag it with proper transport related tag as well, such aspublic_transport=station. Note that there is a special tag for train station buildings -building=train_station.",False,False,False,False
building,tree_house,#d97706,"An accommodation, often designed as a small hut, sometimes also as a room or small apartment. Built on tree posts or on a natural tree. A tree house has no contact with the ground. Access via ladders, stairs or bridgeways.",False,False,False,False
building,triumphal_arch,#d97706,A free-standing monumental structure in the shape of an archway with one or more arched passageways.,False,False,False,False
building,trullo,#d97706,A stone hut with a conical roof.,False,False,False,False
building,university,#d97706,A university building. Useamenity=universityfor the university as an institution.,False,False,False,False
building,*,#d97706,"All commonly used valuesaccording toTaginfo, generallybuilding types",False,False,False,False
building,warehouse,#d97706,A building primarily intended for the storage or goods or as part of a distribution system.,False,False,False,False
building,water_tower,#d97706,A water tower.,False,False,False,False
building,windmill,#d97706,"A building constructed as a traditional windmill, historically used to mill grain with wind power.",False,False,False,False
emergency,ambulance_station,#1e293b,"An ambulance station is a structure or other area set aside for storage of ambulance vehicles, medical equipment, personal protective equipment, and other medical supplies.",False,False,False,False
emergency,assembly_point,#1e293b,A designated (safe) place where people can gather or must report to during an emergency or a fire drill.,True,True,False,False
emergency,defibrillator,#1e293b,"Defibrillator (AED), an external and portable electronic device that diagnoses and can correct arrhythmia of the heart automatically.",False,False,False,False
emergency,drinking_water,#1e293b,A facility that provides drinking water in emergency situations,False,False,False,False
emergency,emergency_ward_entrance,#1e293b,The entrance to an emergency ward.,False,False,False,False
emergency,fire_alarm_box,#1e293b,A device used for notifying a fire department of a fire.,False,False,False,False
emergency,fire_extinguisher,#1e293b,"An active fire protection device used to extinguish or control small fires, often in emergency situations.",False,False,False,False
emergency,fire_hose,#1e293b,A high-pressure hose used to carry water or other fire retardant (such as foam) to a fire to extinguish it.,False,False,False,False
